JournalId,PaperId,Rank,Doi,DocType,Genre,IsParatext,PaperTitle,OriginalTitle,BookTitle,Year,Date,OnlineDate,Publisher,ConferenceSeriesId,ConferenceInstanceId,Volume,Issue,FirstPage,LastPage,ReferenceCount,CitationCount,EstimatedCitation,OriginalVenue,FamilyId,FamilyRank,DocSubTypes,OaStatus,BestUrl,BestFreeUrl,BestFreeVersion,DoiLower,CreatedDate,UpdatedDate
162791694,2895014817,21546,10.1093/MSPECIES/SEY014,Journal,journal-article,f,gorilla beringei primates hominidae,Gorilla beringei (Primates: Hominidae),NA,2018,2018-10-01,2018-10-01,Oxford Academic,NA,NA,50,967,119,133,186,3,3,Mammalian Species,NA,NA,NA,closed,https://doi.org/10.1093/mspecies/sey014,NA,NA,10.1093/mspecies/sey014,NA,2021-11-03 23:47:31.356428
162791694,2979188582,21342,10.1093/MSPECIES/SEZ012,Journal,journal-article,f,tachyglossus aculeatus monotremata tachyglossidae,Tachyglossus aculeatus (Monotremata: Tachyglossidae),NA,2019,2019-10-03,2019-10-03,Oxford Academic,NA,NA,51,980,75,91,124,4,4,Mammalian Species,NA,NA,NA,closed,https://doi.org/10.1093/mspecies/sez012,NA,NA,10.1093/mspecies/sez012,NA,2021-11-03 23:47:31.356428
162791694,3166431454,22699,10.1093/MSPECIES/SEAB005,Journal,journal-article,f,coendou vestitus rodentia erethizontidae,Coendou vestitus (Rodentia: Erethizontidae),NA,2021,2021-06-15,2021-06-15,American Society of Mammalogists,NA,NA,53,1003,43,50,22,0,0,Mammalian Species,NA,NA,NA,closed,https://doi.org/10.1093/mspecies/seab005,NA,NA,10.1093/mspecies/seab005,NA,2021-11-03 23:47:31.356428
162791694,2053858540,21788,10.1644/828.1,Journal,journal-article,f,bathyergus suillus rodentia bathyergidae,Bathyergus suillus (Rodentia: Bathyergidae),NA,2009,2009-03-31,NA,"The American Society of Mammalogists BioOne 21 Dupont Circle, Ste. 800 Washington, DC 20036",NA,NA,828,828,1,7,31,14,15,Mammalian Species,NA,NA,NA,green,https://doi.org/10.1644/828.1,https://zenodo.org/record/5033429/files/source.pdf,submittedVersion,10.1644/828.1,NA,2021-11-03 23:47:31.356428
162791694,2089366457,22548,10.1644/870.1,Journal,journal-article,f,glauconycteris variegata chiroptera vespertilionidae,Glauconycteris variegata (Chiroptera: Vespertilionidae),NA,2010,2010-11-24,NA,"The American Society of Mammalogists BioOne 21 Dupont Circle, Ste. 800 Washington, DC 20036",NA,NA,42,870,251,258,50,4,4,Mammalian Species,NA,NA,NA,bronze,https://doi.org/10.1644/870.1,https://academic.oup.com/mspecies/article-pdf/42/870/251/8269125/42-870-251.pdf,publishedVersion,10.1644/870.1,NA,2021-11-03 23:47:31.356428
162791694,2099988126,21060,10.1644/898.1,Journal,journal-article,f,cabassous centralis cingulata dasypodidae,Cabassous centralis (Cingulata: Dasypodidae),NA,2013,2013-05-31,NA,American Society of Mammologists,NA,NA,45,898,12,17,27,8,8,Mammalian Species,NA,NA,NA,bronze,https://doi.org/10.1644/898.1,https://academic.oup.com/mspecies/article-pdf/45/898/12/8269183/45-898-12.pdf,publishedVersion,10.1644/898.1,NA,2021-11-03 23:47:31.356428
162791694,2144058042,21324,10.1644/848.1,Journal,journal-article,f,lycalopex sechurae carnivora canidae,Lycalopex sechurae (Carnivora: Canidae),NA,2010,2010-03-26,NA,"The American Society of Mammalogists BioOne 21 Dupont Circle, Ste. 800 Washington, DC 20036",NA,NA,42,848,1,6,31,18,20,Mammalian Species,NA,NA,NA,bronze,https://doi.org/10.1644/848.1,https://academic.oup.com/mspecies/article-pdf/42/848/1/8269081/42-848-1.pdf,publishedVersion,10.1644/848.1,NA,2021-11-03 23:47:31.356428
162791694,2169100774,22706,10.1644/889.1,Journal,journal-article,f,tamias umbrinus rodentia sciuridae,Tamias umbrinus (Rodentia: Sciuridae),NA,2011,2011-11-22,NA,"The American Society of Mammalogists BioOne 21 Dupont Circle, Ste. 800 Washington, DC 20036",NA,NA,43,889,216,227,57,1,1,Mammalian Species,NA,NA,NA,bronze,https://doi.org/10.1644/889.1,https://academic.oup.com/mspecies/article-pdf/43/889/216/8269165/43-889-216.pdf,publishedVersion,10.1644/889.1,NA,2021-11-03 23:47:31.356428
162791694,2885110168,21885,10.1093/MSPECIES/SEY004,Journal,journal-article,f,bos frontalis and bos gaurus artiodactyla bovidae,Bos frontalis and Bos gaurus (Artiodactyla: Bovidae),NA,2018,2018-08-17,2018-08-17,American Society of Mammalogists,NA,NA,50,959,34,50,95,5,5,Mammalian Species,NA,NA,NA,bronze,https://doi.org/10.1093/mspecies/sey004,https://academic.oup.com/mspecies/article-pdf/50/959/34/25502514/sey004.pdf,publishedVersion,10.1093/mspecies/sey004,NA,2021-11-03 23:47:31.356428
162791694,2890791126,22975,10.1093/MSPECIES/SEY011,Journal,journal-article,f,urocitellus parryii rodentia sciuridae,Urocitellus parryii (Rodentia: Sciuridae),NA,2018,2018-09-21,2018-09-21,Oxford Academic,NA,NA,50,964,84,99,118,2,2,Mammalian Species,NA,NA,NA,closed,https://doi.org/10.1093/mspecies/sey011,NA,NA,10.1093/mspecies/sey011,NA,2021-11-03 23:47:31.356428
162791694,2951005911,22726,10.1093/MSPECIES/SEZ001,Journal,journal-article,f,trinomys yonenagae rodentia echimyidae,Trinomys yonenagae (Rodentia: Echimyidae),NA,2019,2019-06-06,2019-06-06,Oxford Academic,NA,NA,51,971,1,10,46,2,2,Mammalian Species,NA,NA,NA,closed,https://doi.org/10.1093/mspecies/sez001,NA,NA,10.1093/mspecies/sez001,NA,2021-11-03 23:47:31.356428
162791694,3159957627,21791,10.1093/MSPECIES/SEAB003,Journal,journal-article,f,sturnira hondurensis chiroptera phyllostomidae,Sturnira hondurensis (Chiroptera: Phyllostomidae),NA,2021,2021-04-24,2021-04-24,Oxford University Press (OUP),NA,NA,53,1001,23,34,68,0,0,Mammalian Species,NA,NA,NA,closed,https://doi.org/10.1093/mspecies/seab003,NA,NA,10.1093/mspecies/seab003,NA,2021-11-03 23:47:31.356428
162791694,3199954414,22513,NA,Journal,NA,NA,sorex cinereus kerr 1792,"Sorex cinereus Kerr, 1792",NA,2004,2004-03-24,NA,NA,NA,NA,743,NA,1,9,0,12,13,Mammalian Species,NA,NA,NA,NA,NA,NA,NA,NA,NA,2021-11-04 00:07:59.89108
162791694,2101204413,21424,10.1644/835.1,Journal,NA,NA,equus kiang perissodactyla equidae,Equus kiang (Perissodactyla: Equidae),NA,2009,2009-06-01,NA,"The American Society of Mammalogists BioOne 21 Dupont Circle, Ste. 800 Washington, DC 20036",NA,NA,835,835,1,11,54,23,26,Mammalian Species,NA,NA,NA,NA,NA,NA,NA,10.1644/835.1,NA,2021-11-04 00:07:59.89108
162791694,2127070242,22685,10.1644/814.1,Journal,journal-article,f,sphaeronycteris toxophyllum chiroptera phyllostomidae,Sphaeronycteris toxophyllum (Chiroptera: Phyllostomidae),NA,2008,2008-06-06,NA,"The American Society of Mammalogists BioOne 21 Dupont Circle, Ste. 800 Washington, DC 20036",NA,NA,814,814,1,6,28,5,5,Mammalian Species,NA,NA,NA,bronze,https://doi.org/10.1644/814.1,https://academic.oup.com/mspecies/article-pdf/doi/10.1644/814.1/24460929/814.pdf,publishedVersion,10.1644/814.1,NA,2021-11-03 23:47:31.356428
162791694,2185248433,21798,10.1093/MSPECIES/SEV007,Journal,journal-article,f,felis margarita carnivora felidae,Felis margarita (Carnivora: Felidae),NA,2015,2015-08-31,2015-08-31,American Society of Mammalogists,NA,NA,47,924,63,77,51,3,3,Mammalian Species,NA,NA,NA,bronze,https://doi.org/10.1093/mspecies/sev007,https://academic.oup.com/mspecies/article-pdf/47/924/63/8129575/sev007.pdf,publishedVersion,10.1093/mspecies/sev007,NA,2021-11-03 23:47:31.356428
162791694,2329916633,23618,10.2307/3503803,Journal,journal-article,f,sorex dispar and sorex gaspensis,Sorex dispar and Sorex gaspensis,NA,1981,1981-05-08,NA,Oxford Academic,NA,NA,NA,155,1,4,0,15,16,Mammalian Species,NA,NA,NA,closed,https://doi.org/10.2307/3503803,NA,NA,10.2307/3503803,NA,2021-11-03 23:47:31.356428
162791694,2331859636,23196,10.2307/3504205,Journal,journal-article,f,balantiopteryx io and balantiopteryx infusca,Balantiopteryx io and Balantiopteryx infusca,NA,1988,1988-06-30,NA,Narnia,NA,NA,NA,313,1,3,0,10,10,Mammalian Species,NA,NA,NA,closed,https://doi.org/10.2307/3504205,NA,NA,10.2307/3504205,NA,2021-11-03 23:47:31.356428
162791694,2888107134,22370,10.1093/MSPECIES/SEY007,Journal,journal-article,f,chinchilla chinchilla rodentia chinchillidae,Chinchilla chinchilla (Rodentia: Chinchillidae),NA,2018,2018-08-20,2018-08-20,American Society of Mammalogists,NA,NA,50,960,51,58,36,1,1,Mammalian Species,NA,NA,NA,bronze,https://doi.org/10.1093/mspecies/sey007,https://academic.oup.com/mspecies/article-pdf/50/960/51/25504526/sey007.pdf,publishedVersion,10.1093/mspecies/sey007,NA,2021-11-03 23:47:31.356428
162791694,2932023343,21235,10.1093/MSPECIES/SEY018,Journal,journal-article,f,erratum microsciurus santanderensis rodentia sciuridae,Erratum: Microsciurus santanderensis (Rodentia: Sciuridae),NA,2018,2018-10-25,2019-04-04,Oxford Academic,NA,NA,50,970,1,1,0,1,1,Mammalian Species,NA,NA,NA,bronze,https://doi.org/10.1093/mspecies/sey018,https://academic.oup.com/mspecies/article-pdf/50/970/e1/29349943/sey018.pdf,publishedVersion,10.1093/mspecies/sey018,NA,2021-11-03 23:47:31.356428
162791694,3013385737,23310,10.1093/MSPECIES/SEZ021,Journal,journal-article,f,corrigendum to trinomys yonenagae rodentia echimyidae,Corrigendum to: Trinomys yonenagae (Rodentia: Echimyidae),NA,2019,2019-06-06,2020-03-26,Oxford University Press (OUP),NA,NA,51,971,NA,NA,3,0,0,Mammalian Species,NA,NA,NA,bronze,https://doi.org/10.1093/mspecies/sez021,https://academic.oup.com/mspecies/article-pdf/51/971/e2/32969297/sez021.pdf,publishedVersion,10.1093/mspecies/sez021,NA,2021-11-03 23:47:31.356428
162791694,2015664504,20100,10.1644/874.1,Journal,journal-article,f,tamandua mexicana pilosa myrmecophagidae,Tamandua mexicana (Pilosa: Myrmecophagidae),NA,2011,2011-03-28,NA,"The American Society of Mammalogists BioOne 21 Dupont Circle, Ste. 800 Washington, DC 20036",NA,NA,43,874,56,63,46,31,37,Mammalian Species,NA,NA,NA,bronze,https://doi.org/10.1644/874.1,https://academic.oup.com/mspecies/article-pdf/43/874/56/8269135/43-874-56.pdf,publishedVersion,10.1644/874.1,NA,2021-11-03 23:47:31.356428
162791694,2043868860,19757,10.1644/871.1,Journal,journal-article,f,rusa unicolor artiodactyla cervidae,Rusa unicolor (Artiodactyla: Cervidae),NA,2011,2011-01-25,2011-01-01,The American Society of Mammalogists,NA,NA,43,871,1,30,233,59,73,Mammalian Species,NA,NA,NA,bronze,https://doi.org/10.1644/871.1,https://academic.oup.com/mspecies/article-pdf/43/871/1/8269129/43-871-1.pdf,publishedVersion,10.1644/871.1,NA,2021-11-03 23:47:31.356428
162791694,2062854295,22807,10.1644/910,Journal,journal-article,f,tylonycteris pachypus chiroptera vespertilionidae,Tylonycteris pachypus(Chiroptera: Vespertilionidae),NA,2014,2014-10-06,NA,American Society of Mammologists,NA,NA,46,910,33,39,28,0,0,Mammalian Species,NA,NA,NA,bronze,https://doi.org/10.1644/910,https://academic.oup.com/mspecies/article-pdf/46/910/33/8269211/46-910-33.pdf,publishedVersion,10.1644/910,NA,2021-11-03 23:47:31.356428
162791694,2111858454,21061,10.1644/827.1,Journal,journal-article,f,conepatus leuconotus carnivora mephitidae,Conepatus leuconotus (Carnivora: Mephitidae),NA,2009,2009-02-26,NA,"The American Society of Mammalogists BioOne 21 Dupont Circle, Ste. 800 Washington, DC 20036",NA,NA,827,827,1,8,48,15,17,Mammalian Species,NA,NA,NA,bronze,https://doi.org/10.1644/827.1,https://academic.oup.com/mspecies/article-pdf/doi/10.1644/827.1/24461029/827.pdf,publishedVersion,10.1644/827.1,NA,2021-11-03 23:47:31.356428
162791694,2122549196,22404,10.1644/904.1,Journal,journal-article,f,elaphodus cephalophus artiodactyla cervidae,Elaphodus cephalophus (Artiodactyla: Cervidae),NA,2013,2013-12-13,2013-01-01,American Society of Mammologists,NA,NA,45,904,80,91,59,6,6,Mammalian Species,NA,NA,NA,green,https://doi.org/10.1644/904.1,https://bioone.org/journals/mammalian-species/volume-45/issue-904/904.1/Elaphodus-cephalophus-Artiodactyla-Cervidae/10.1644/904.1.pdf,submittedVersion,10.1644/904.1,NA,2021-11-03 23:47:31.356428
162791694,2471284898,24999,NA,Journal,NA,NA,liomys spectabilis genoways 1971 jaliscan spiny pocket mouse,"Liomys spectabilis genoways, 1971: Jaliscan Spiny Pocket Mouse",NA,2003,2003-01-01,NA,American Society of Mammalogists,NA,NA,718,NA,1,3,0,0,0,Mammalian Species,NA,NA,NA,NA,NA,NA,NA,NA,NA,NA
162791694,3044062939,23309,10.1093/MSPECIES/SEAA004,Journal,journal-article,f,dasypus sabanicola cingulata dasypodidae,Dasypus sabanicola (Cingulata: Dasypodidae),NA,2020,2020-07-22,2020-07-22,Oxford Academic,NA,NA,52,991,49,56,38,0,0,Mammalian Species,NA,NA,NA,bronze,https://doi.org/10.1093/mspecies/seaa004,https://academic.oup.com/mspecies/article-pdf/52/991/49/33521360/seaa004.pdf,publishedVersion,10.1093/mspecies/seaa004,NA,2021-11-03 23:47:31.356428
162791694,2016387185,21522,10.1644/843.1,Journal,journal-article,f,tetracerus quadricornis artiodactyla bovidae,Tetracerus quadricornis (Artiodactyla: Bovidae),NA,2009,2009-09-25,NA,"The American Society of Mammalogists BioOne 21 Dupont Circle, Ste. 800 Washington, DC 20036",NA,NA,843,843,1,11,70,19,21,Mammalian Species,NA,NA,NA,bronze,https://doi.org/10.1644/843.1,https://academic.oup.com/mspecies/article-pdf/doi/10.1644/843.1/24461167/843.pdf,publishedVersion,10.1644/843.1,NA,2021-11-03 23:47:31.356428
162791694,2102214823,21455,10.1644/818.1,Journal,journal-article,f,anoura geoffroyi chiroptera phyllostomidae,Anoura Geoffroyi (Chiroptera: Phyllostomidae),NA,2008,2008-10-09,NA,"The American Society of Mammalogists BioOne 21 Dupont Circle, Ste. 800 Washington, DC 20036",NA,NA,818,818,1,7,54,19,21,Mammalian Species,NA,NA,NA,bronze,https://doi.org/10.1644/818.1,https://academic.oup.com/mspecies/article-pdf/doi/10.1644/818.1/24460958/818.pdf,publishedVersion,10.1644/818.1,NA,2021-11-03 23:47:31.356428
162791694,2103498984,21856,10.1644/893.1,Journal,journal-article,f,akodon cursor rodentia cricetidae,Akodon cursor (Rodentia: Cricetidae),NA,2012,2012-06-15,NA,"The American Society of Mammalogists BioOne 21 Dupont Circle, Ste. 800 Washington, DC 20036",NA,NA,44,893,33,43,51,11,12,Mammalian Species,NA,NA,NA,bronze,https://doi.org/10.1644/893.1,https://academic.oup.com/mspecies/article-pdf/44/893/33/8269173/44-893-33.pdf,publishedVersion,10.1644/893.1,NA,2021-11-03 23:47:31.356428
162791694,2138297971,20465,10.1644/876.1,Journal,journal-article,f,martes zibellina carnivora mustelidae,Martes zibellina (Carnivora: Mustelidae),NA,2011,2011-05-26,NA,"The American Society of Mammalogists BioOne 21 Dupont Circle, Ste. 800 Washington, DC 20036",NA,NA,43,876,75,86,15,25,29,Mammalian Species,NA,NA,NA,bronze,https://doi.org/10.1644/876.1,https://academic.oup.com/mspecies/article-pdf/43/876/75/8269139/43-876-75.pdf,publishedVersion,10.1644/876.1,NA,2021-11-03 23:47:31.356428
162791694,2145686073,22167,10.1644/825.1,Journal,journal-article,f,otonyctomys hatti rodentia cricetidae,Otonyctomys hatti (Rodentia: Cricetidae),NA,2009,2009-02-26,NA,"The American Society of Mammalogists BioOne 21 Dupont Circle, Ste. 800 Washington, DC 20036",NA,NA,825,825,1,5,11,3,3,Mammalian Species,NA,NA,NA,bronze,https://doi.org/10.1644/825.1,https://academic.oup.com/mspecies/article-pdf/doi/10.1644/825.1/24461018/825.pdf,publishedVersion,10.1644/825.1,NA,2021-11-03 23:47:31.356428
162791694,2147179131,21270,10.1644/895.1,Journal,journal-article,f,cyclopes didactylus pilosa cyclopedidae,Cyclopes didactylus (Pilosa: Cyclopedidae),NA,2012,2012-09-26,NA,American Society of Mammologists,NA,NA,44,895,51,58,47,14,15,Mammalian Species,NA,NA,NA,bronze,https://doi.org/10.1644/895.1,https://academic.oup.com/mspecies/article-pdf/44/895/51/8269177/44-895-51.pdf,publishedVersion,10.1644/895.1,NA,2021-11-03 23:47:31.356428
162791694,2169907141,22580,10.1644/833.1,Journal,journal-article,f,peromyscus perfulvus rodentia cricetidae,Peromyscus perfulvus (Rodentia: Cricetidae),NA,2009,2009-06-01,NA,"The American Society of Mammalogists BioOne 21 Dupont Circle, Ste. 800 Washington, DC 20036",NA,NA,833,833,1,8,27,3,3,Mammalian Species,NA,NA,NA,bronze,https://doi.org/10.1644/833.1,https://academic.oup.com/mspecies/article-pdf/doi/10.1644/833.1/24461080/833.pdf,publishedVersion,10.1644/833.1,NA,2021-11-03 23:47:31.356428
162791694,2754334296,21979,10.1093/MSPECIES/SEX013,Journal,journal-article,f,sigmodon mascotensis rodentia cricetidae,Sigmodon mascotensis (Rodentia: Cricetidae),NA,2017,2017-09-11,2017-09-11,Oxford University Press,NA,NA,49,954,109,118,41,0,0,Mammalian Species,NA,NA,NA,bronze,https://doi.org/10.1093/mspecies/sex013,https://academic.oup.com/mspecies/article-pdf/49/954/109/19711523/sex013.pdf,publishedVersion,10.1093/mspecies/sex013,NA,2021-11-03 23:47:31.356428
162791694,2993825816,23170,10.1093/MSPECIES/SEZ016,Journal,journal-article,f,lasiurus varius chiroptera vespertilionidae,Lasiurus varius (Chiroptera: Vespertilionidae),NA,2019,2019-12-06,2019-12-06,Oxford Academic,NA,NA,51,983,119,127,37,2,2,Mammalian Species,NA,NA,NA,closed,https://doi.org/10.1093/mspecies/sez016,NA,NA,10.1093/mspecies/sez016,NA,2021-11-03 23:47:31.356428
162791694,3198874073,20911,10.1093/MSPECIES/SEAB010,Journal,journal-article,f,peromyscus fraterculus rodentia cricetidae,Peromyscus fraterculus (Rodentia: Cricetidae),NA,2021,2021-09-09,2021-09-09,Oxford Academic,NA,NA,53,1008,112,124,76,0,0,Mammalian Species,NA,NA,NA,closed,https://doi.org/10.1093/mspecies/seab010,NA,NA,10.1093/mspecies/seab010,NA,2021-11-03 23:47:31.356428
162791694,1842701357,21429,10.1093/MSPECIES/SEV002,Journal,journal-article,f,potamochoerus porcus artiodactyla suidae,Potamochoerus porcus (Artiodactyla: Suidae),NA,2015,2015-12-13,2015-07-03,American Society of Mammalogists,NA,NA,47,919,15,31,132,10,11,Mammalian Species,NA,NA,NA,bronze,https://doi.org/10.1093/mspecies/sev002,https://academic.oup.com/mspecies/article-pdf/47/919/15/8129525/sev002.pdf,publishedVersion,10.1093/mspecies/sev002,NA,2021-11-03 23:47:31.356428
162791694,2080591448,21249,10.1644/879.1,Journal,journal-article,f,geomys bursarius rodentia geomyidae,Geomys bursarius (Rodentia: Geomyidae),NA,2011,2011-07-28,NA,"The American Society of Mammalogists BioOne 21 Dupont Circle, Ste. 800 Washington, DC 20036",NA,NA,43,879,104,117,143,9,9,Mammalian Species,NA,NA,NA,bronze,https://doi.org/10.1644/879.1,https://academic.oup.com/mspecies/article-pdf/43/879/104/8269145/43-879-104.pdf,publishedVersion,10.1644/879.1,NA,2021-11-03 23:47:31.356428
162791694,2317901756,27285,10.2307/3503867,Journal,journal-article,f,reithrodontomys brevirostris and reithrodontomys paradoxus,Reithrodontomys brevirostris and Reithrodontomys paradoxus,NA,1982,1982-11-23,NA,NA,NA,NA,NA,192,1,NA,0,0,0,Mammalian Species,NA,NA,NA,closed,https://doi.org/10.2307/3503867,NA,NA,10.2307/3503867,NA,2021-11-03 23:47:31.356428
162791694,2346827674,21013,10.1093/MSPECIES/SEW002,Journal,journal-article,f,priodontes maximus cingulata chlamyphoridae,Priodontes maximus (Cingulata: Chlamyphoridae),NA,2016,2016-05-05,2016-05-05,Oxford University Press,NA,NA,48,932,21,34,106,16,18,Mammalian Species,NA,NA,NA,bronze,https://doi.org/10.1093/mspecies/sew002,https://academic.oup.com/mspecies/article-pdf/48/932/21/7971194/sew002.pdf,publishedVersion,10.1093/mspecies/sew002,NA,2021-11-03 23:47:31.356428
162791694,2748101657,21172,10.1093/MSPECIES/SEX009,Journal,journal-article,f,sciurus aureogaster rodentia sciuridae,Sciurus aureogaster (Rodentia: Sciuridae),NA,2017,2017-08-17,2017-08-17,American Society of Mammalogists,NA,NA,49,951,81,92,70,1,1,Mammalian Species,NA,NA,NA,bronze,https://doi.org/10.1093/mspecies/sex009,https://academic.oup.com/mspecies/article-pdf/49/951/81/19522465/sex009.pdf,publishedVersion,10.1093/mspecies/sex009,NA,2021-11-03 23:47:31.356428
162791694,2748588325,21344,10.1093/MSPECIES/SEX010,Journal,journal-article,f,sciurus sanborni rodentia sciuridae,Sciurus sanborni (Rodentia: Sciuridae),NA,2017,2017-08-19,2017-08-19,Oxford Academic,NA,NA,49,952,93,96,13,0,0,Mammalian Species,NA,NA,NA,bronze,https://doi.org/10.1093/mspecies/sex010,https://academic.oup.com/mspecies/article-pdf/49/952/93/19532736/sex010.pdf,publishedVersion,10.1093/mspecies/sex010,NA,2021-11-03 23:47:31.356428
162791694,2961162602,22801,10.1093/MSPECIES/SEZ003,Journal,journal-article,f,histiotus magellanicus chiroptera vespertilionidae,Histiotus magellanicus (Chiroptera: Vespertilionidae),NA,2019,2019-07-17,2019-07-17,Oxford Academic,NA,NA,51,973,18,25,35,2,2,Mammalian Species,NA,NA,NA,bronze,https://doi.org/10.1093/mspecies/sez003,https://academic.oup.com/mspecies/article-pdf/51/973/18/29113811/sez003.pdf,publishedVersion,10.1093/mspecies/sez003,NA,2021-11-03 23:47:31.356428
162791694,2053146911,22093,10.1644/829.1,Journal,journal-article,f,bradypus torquatus pilosa bradypodidae,Bradypus torquatus (Pilosa: Bradypodidae),NA,2009,2009-03-31,NA,American Society of Mammalogists,NA,NA,829,829,1,5,21,11,12,Mammalian Species,NA,NA,NA,bronze,https://doi.org/10.1644/829.1,https://academic.oup.com/mspecies/article-pdf/doi/10.1644/829.1/24461047/829.pdf,publishedVersion,10.1644/829.1,NA,2021-11-03 23:47:31.356428
162791694,2126242270,21956,10.1644/903.1,Journal,journal-article,f,sciurillus pusillus rodentia sciuridae,Sciurillus pusillus (Rodentia: Sciuridae),NA,2013,2013-12-13,NA,American Society of Mammologists,NA,NA,45,903,75,79,27,6,6,Mammalian Species,NA,NA,NA,bronze,https://doi.org/10.1644/903.1,https://academic.oup.com/mspecies/article-pdf/45/903/75/8269195/45-903-75.pdf,publishedVersion,10.1644/903.1,NA,2021-11-03 23:47:31.356428
162791694,2207148034,21519,10.1093/MSPECIES/SEV008,Journal,journal-article,f,felis nigripes carnivora felidae,Felis nigripes (Carnivora: Felidae),NA,2015,2015-10-23,2015-10-23,American Society of Mammalogists,NA,NA,47,925,78,83,44,4,4,Mammalian Species,NA,NA,NA,bronze,https://doi.org/10.1093/mspecies/sev008,https://academic.oup.com/mspecies/article-pdf/47/925/78/8129611/sev008.pdf,publishedVersion,10.1093/mspecies/sev008,NA,2021-11-03 23:47:31.356428
162791694,2345865883,21790,10.1093/MSPECIES/SEW001,Journal,journal-article,f,dasypus hybridus cingulata dasypodidae,Dasypus hybridus (Cingulata: Dasypodidae),NA,2016,2016-05-04,2016-05-04,The Oxford University Press,NA,NA,48,931,10,20,72,9,10,Mammalian Species,NA,NA,NA,bronze,https://doi.org/10.1093/mspecies/sew001,https://academic.oup.com/mspecies/article-pdf/48/931/10/7971127/sew001.pdf,publishedVersion,10.1093/mspecies/sew001,NA,2021-11-03 23:47:31.356428
162791694,2740411011,22761,10.1093/MSPECIES/SEX007,Journal,journal-article,f,nyctimene robinsoni chiroptera pteropodidae,Nyctimene robinsoni (Chiroptera: Pteropodidae),NA,2017,2017-07-27,2017-07-27,American Society of Mammalogists,NA,NA,49,949,68,75,25,0,0,Mammalian Species,NA,NA,NA,bronze,https://doi.org/10.1093/mspecies/sex007,https://academic.oup.com/mspecies/article-pdf/49/949/68/19297099/sex007.pdf,publishedVersion,10.1093/mspecies/sex007,NA,2021-11-03 23:47:31.356428
162791694,2799416233,21371,10.1093/MSPECIES/SEY003,Journal,journal-article,f,plecotus macrobullaris chiroptera vespertilionidae,Plecotus macrobullaris (Chiroptera: Vespertilionidae),NA,2018,2018-05-09,2018-05-09,Oxford University Press (OUP),NA,NA,50,958,26,33,31,1,1,Mammalian Species,NA,NA,NA,bronze,https://doi.org/10.1093/mspecies/sey003,https://academic.oup.com/mspecies/article-pdf/50/958/26/24798747/sey003.pdf,publishedVersion,10.1093/mspecies/sey003,NA,2021-11-03 23:47:31.356428
162791694,2980703513,23894,10.1093/MSPECIES/SEZ013,Journal,journal-article,f,aegialomys galapagoensis rodentia cricetidae,Aegialomys galapagoensis (Rodentia: Cricetidae),NA,2019,2019-10-14,2019-10-14,Oxford Academic,NA,NA,51,981,92,99,27,0,0,Mammalian Species,NA,NA,NA,bronze,https://doi.org/10.1093/mspecies/sez013,https://academic.oup.com/mspecies/article-pdf/51/981/92/30140141/sez013.pdf,publishedVersion,10.1093/mspecies/sez013,NA,2021-11-03 23:47:31.356428
162791694,2003781051,20933,10.1644/832.1,Journal,journal-article,f,vulpes corsac carnivora canidae,Vulpes corsac (Carnivora: Canidae),NA,2009,2009-06-01,NA,"The American Society of Mammalogists BioOne 21 Dupont Circle, Ste. 800 Washington, DC 20036",NA,NA,832,832,1,8,48,16,18,Mammalian Species,NA,NA,NA,bronze,https://doi.org/10.1644/832.1,https://academic.oup.com/mspecies/article-pdf/doi/10.1644/832.1/24461060/832.pdf,publishedVersion,10.1644/832.1,NA,2021-11-03 23:47:31.356428
162791694,2038740990,22238,10.1644/909,Journal,journal-article,f,cabassous tatouay cingulata dasypodidae,Cabassous tatouay (Cingulata: Dasypodidae),NA,2014,2014-09-11,NA,American Society of Mammologists,NA,NA,46,909,28,32,31,4,4,Mammalian Species,NA,NA,NA,closed,https://doi.org/10.1644/909,NA,NA,10.1644/909,NA,2021-11-03 23:47:31.356428
162791694,2153660520,22904,10.1093/MSPECIES/SEV003,Journal,journal-article,f,acrobates pygmaeus diprotodontia acrobatidae,Acrobates pygmaeus (Diprotodontia: Acrobatidae),NA,2015,2015-07-01,2015-07-06,American Society of Mammalogists,NA,NA,47,920,32,44,140,2,2,Mammalian Species,NA,NA,NA,bronze,https://doi.org/10.1093/mspecies/sev003,https://academic.oup.com/mspecies/article-pdf/47/920/32/8129535/sev003.pdf,publishedVersion,10.1093/mspecies/sev003,NA,2021-11-03 23:47:31.356428
162791694,2163619488,22350,10.1644/826.1,Journal,journal-article,f,bassaricyon gabbii carnivora procyonidae,Bassaricyon gabbii (Carnivora: Procyonidae),NA,2009,2009-02-26,NA,"The American Society of Mammalogists BioOne 21 Dupont Circle, Ste. 800 Washington, DC 20036",NA,NA,826,826,1,7,44,6,6,Mammalian Species,NA,NA,NA,bronze,https://doi.org/10.1644/826.1,https://academic.oup.com/mspecies/article-pdf/doi/10.1644/826.1/24461034/826.pdf,publishedVersion,10.1644/826.1,NA,2021-11-03 23:47:31.356428
162791694,2171670255,21178,10.1644/917.1,Journal,journal-article,f,mustela africana carnivora mustelidae,Mustela africana (Carnivora: Mustelidae),NA,2014,2014-12-18,NA,American Society of Mammologists,NA,NA,46,917,110,115,14,3,3,Mammalian Species,NA,NA,NA,bronze,https://doi.org/10.1644/917.1,https://academic.oup.com/mspecies/article-pdf/46/917/110/8269248/46-917-110.pdf,publishedVersion,10.1644/917.1,NA,2021-11-03 23:47:31.356428
162791694,2272090853,23188,NA,Journal,NA,NA,mammalian species no 664 reithrodon auritus,Mammalian species No. 664: Reithrodon auritus,NA,2001,2001-01-01,NA,NA,NA,NA,NA,NA,NA,NA,0,6,6,Mammalian Species,NA,NA,NA,NA,NA,NA,NA,NA,NA,NA
